Issue Key,Summary,Description,Assignee,Reporter,Issue Type,Priority,Status,Component,Created,Due Date,Days to Complete,Created_Month,Created_Day_of_Week,Due_Month,summary_cleaned,description_cleaned,combined_text,summary_lemmatized,description_lemmatized,combined_lemmatized,summary_word_count,description_word_count,combined_word_count
SWP-42,Workflow Automation Error,Business process automation fails to assign tasks due to approval chain misconfiguration.,Frank,Heidi,Bug,Medium,Open,Workflow,07-06-2025,15-06-2025,8,6,5,6,workflow automation error,business process automation fails to assign tasks due to approval chain misconfiguration,workflow automation error business process automation fails to assign tasks due to approval chain misconfiguration,automation error,automation fail assign chain misconfiguration,automation error automation fail assign chain misconfiguration,3,12,15
SWP-43,Multi-tenant Data Leak,SaaS multi-tenant system exposes tenant data due to improper data isolation.,Charlie,Ivan,Bug,High,In Progress,Multi-tenancy,08-06-2025,21-06-2025,13,6,6,6,multitenant data leak,saas multitenant system exposes tenant data due to improper data isolation,multitenant data leak saas multitenant system exposes tenant data due to improper data isolation,multitenant leak,saas multitenant expose tenant improper isolation,multitenant leak saas multitenant expose tenant improper isolation,3,11,14
SWP-44,API Documentation Portal,"Build interactive API documentation with code examples, testing interface, and version management features.",Frank,Heidi,Story,Medium,Done,API,15-05-2025,27-05-2025,12,5,3,5,api documentation portal,build interactive api documentation with code examples testing interface and version management features,api documentation portal build interactive api documentation with code examples testing interface and version management features,documentation portal,interactive documentation version,documentation portal interactive documentation version,3,13,16
SWP-45,Event-driven Message Loss,Event sourcing system loses messages due to queue overflow.,Frank,Ivan,Bug,High,Open,Event System,11-05-2025,21-05-2025,10,5,6,5,eventdriven message loss,event sourcing system loses messages due to queue overflow,eventdriven message loss event sourcing system loses messages due to queue overflow,eventdriven loss,event source loses queue overflow,eventdriven loss event source loses queue overflow,3,9,12
SWP-46,Configuration Management,"Create centralized configuration system with environment-specific settings, secret management, and dynamic updates.",Frank,Ivan,Task,High,Done,Configuration,22-06-2025,26-06-2025,4,6,6,6,configuration management,create centralized configuration system with environmentspecific settings secret management and dynamic updates,configuration management create centralized configuration system with environmentspecific settings secret management and dynamic updates,,centralize environmentspecific secret dynamic, centralize environmentspecific secret dynamic,2,12,14
SWP-47,Health Check System,"Develop application health monitoring with service dependency checks, automated recovery, and alerting mechanisms.",Eve,Grace,Task,High,In Progress,Monitoring,05-07-2025,15-07-2025,10,7,5,7,health check system,develop application health monitoring with service dependency checks automated recovery and alerting mechanisms,health check system develop application health monitoring with service dependency checks automated recovery and alerting mechanisms,health,health monitoring dependency automate recovery alerting mechanism,health health monitoring dependency automate recovery alerting mechanism,3,13,16
SWP-48,Audit Trail Implementation,"Build comprehensive audit logging with user action tracking, data change history, and compliance reporting.",Alice,Grace,Task,High,Done,Audit,31-05-2025,15-06-2025,15,5,5,6,audit trail implementation,build comprehensive audit logging with user action tracking data change history and compliance reporting,audit trail implementation build comprehensive audit logging with user action tracking data change history and compliance reporting,audit trail,comprehensive audit log action track history compliance reporting,audit trail comprehensive audit log action track history compliance reporting,3,14,17
SWP-49,Load Testing Framework,"Create performance testing suite with load generation, bottleneck identification, and scalability analysis tools.",Alice,Judy,Task,Medium,In Progress,Testing,27-05-2025,01-06-2025,5,5,1,6,load testing framework,create performance testing suite with load generation bottleneck identification and scalability analysis tools,load testing framework create performance testing suite with load generation bottleneck identification and scalability analysis tools,load,performance suite load generation bottleneck identification scalability analysis,load performance suite load generation bottleneck identification scalability analysis,3,13,16
SWP-50,Feature Flag System,"Implement feature toggles with gradual rollout, A/B testing capabilities, and real-time feature management.",Bob,Judy,Task,Medium,Done,Feature Management,14-06-2025,24-06-2025,10,6,5,6,feature flag system,implement feature toggles with gradual rollout ab testing capabilities and realtime feature management,feature flag system implement feature toggles with gradual rollout ab testing capabilities and realtime feature management,flag,toggle gradual rollout ab capability realtime,flag toggle gradual rollout ab capability realtime,3,13,16
SWP-51,CRM Contact Sync Failure,CRM system fails to sync contacts with external email platforms.,Alice,Ivan,Bug,High,In Progress,CRM,17-06-2025,23-06-2025,6,6,1,6,crm contact sync failure,crm system fails to sync contacts with external email platforms,crm contact sync failure crm system fails to sync contacts with external email platforms,sync failure,fails sync external,sync failure fails sync external,4,10,14
SWP-52,Time Tracking Application,"Develop time tracking tool with project allocation, timesheet management, and productivity analytics.",Bob,Heidi,Story,Medium,Done,Time Tracking,23-06-2025,27-06-2025,4,6,0,6,time tracking application,develop time tracking tool with project allocation timesheet management and productivity analytics,time tracking application develop time tracking tool with project allocation timesheet management and productivity analytics,track,track allocation timesheet productivity analytics,track track allocation timesheet productivity analytics,3,12,15
SWP-53,Knowledge Base System,"Create searchable knowledge base with article management, categorization, and user contribution features.",Eve,Grace,Story,Low,Open,Knowledge Base,26-05-2025,10-06-2025,15,5,0,6,knowledge base system,create searchable knowledge base with article management categorization and user contribution features,knowledge base system create searchable knowledge base with article management categorization and user contribution features,knowledge base,searchable knowledge base article categorization contribution,knowledge base searchable knowledge base article categorization contribution,3,12,15
SWP-54,Bug Tracking System,"Build issue tracking platform with bug reporting, assignment workflows, and resolution tracking capabilities.",Diana,Heidi,Story,Medium,Done,Testing,13-05-2025,23-05-2025,10,5,1,5,bug tracking system,build issue tracking platform with bug reporting assignment workflows and resolution tracking capabilities,bug tracking system build issue tracking platform with bug reporting assignment workflows and resolution tracking capabilities,track,track report assignment resolution track capability,track track report assignment resolution track capability,3,13,16
SWP-55,Asset Tracking Discrepancy,IT asset tracking system shows incorrect software license counts.,Diana,Heidi,Bug,Medium,Open,Asset Management,07-07-2025,17-07-2025,10,7,0,7,asset tracking discrepancy,it asset tracking system shows incorrect software license counts,asset tracking discrepancy it asset tracking system shows incorrect software license counts,asset tracking discrepancy,asset tracking show incorrect license count,asset tracking discrepancy asset tracking show incorrect license count,3,9,12
SWP-56,Subscription Billing Error,Recurring billing system charges incorrect amounts due to plan miscalculation.,Diana,Heidi,Bug,High,In Progress,Payment Processing,28-05-2025,31-05-2025,3,5,2,5,subscription billing error,recurring billing system charges incorrect amounts due to plan miscalculation,subscription billing error recurring billing system charges incorrect amounts due to plan miscalculation,subscription billing error,recur billing charge incorrect amount plan miscalculation,subscription billing error recur billing charge incorrect amount plan miscalculation,3,10,13
SWP-57,Project Portfolio Management,"Build project tracking with resource allocation, milestone tracking, and portfolio-level reporting.",Charlie,Judy,Epic,Medium,In Progress,Project Management,04-07-2025,11-07-2025,7,7,4,7,project portfolio management,build project tracking with resource allocation milestone tracking and portfoliolevel reporting,project portfolio management build project tracking with resource allocation milestone tracking and portfoliolevel reporting,portfolio,track resource allocation milestone track portfoliolevel reporting,portfolio track resource allocation milestone track portfoliolevel reporting,3,11,14
SWP-58,Compliance Monitoring,"Implement regulatory compliance tracking with audit preparation, violation detection, and remediation workflows.",Frank,Grace,Task,High,In Progress,Compliance,15-06-2025,30-06-2025,15,6,6,6,compliance monitoring,implement regulatory compliance tracking with audit preparation violation detection and remediation workflows,compliance monitoring implement regulatory compliance tracking with audit preparation violation detection and remediation workflows,compliance monitoring,regulatory compliance track audit preparation violation detection remediation,compliance monitoring regulatory compliance track audit preparation violation detection remediation,2,12,14
SWP-59,Vendor Management System,"Create supplier relationship management with contract tracking, performance evaluation, and procurement workflows.",Diana,Grace,Epic,Medium,Done,Vendor Management,08-07-2025,20-07-2025,12,7,1,7,vendor management system,create supplier relationship management with contract tracking performance evaluation and procurement workflows,vendor management system create supplier relationship management with contract tracking performance evaluation and procurement workflows,,supplier relationship contract track performance evaluation procurement, supplier relationship contract track performance evaluation procurement,3,12,15
SWP-60,Quality Assurance Platform,"Build testing management system with test case creation, execution tracking, and defect reporting.",Frank,Grace,Story,Medium,Done,Testing,18-05-2025,02-06-2025,15,5,6,6,quality assurance platform,build testing management system with test case creation execution tracking and defect reporting,quality assurance platform build testing management system with test case creation execution tracking and defect reporting,assurance,creation execution track reporting,assurance creation execution track reporting,3,13,16
SWP-61,Digital Signature Verification Failure,Electronic signatures fail verification due to certificate mismatch.,Diana,Judy,Bug,Medium,In Progress,Document Management,24-06-2025,08-07-2025,14,6,1,7,digital signature verification failure,electronic signatures fail verification due to certificate mismatch,digital signature verification failure electronic signatures fail verification due to certificate mismatch,digital signature failure,electronic signature fail certificate mismatch,digital signature failure electronic signature fail certificate mismatch,4,8,12
SWP-62,Expense Management System,"Create expense tracking with receipt scanning, approval workflows, and reimbursement processing.",Frank,Grace,Story,Medium,Done,Expense Management,05-06-2025,20-06-2025,15,6,3,6,expense management system,create expense tracking with receipt scanning approval workflows and reimbursement processing,expense management system create expense tracking with receipt scanning approval workflows and reimbursement processing,expense,expense track receipt scan reimbursement,expense expense track receipt scan reimbursement,3,11,14
SWP-63,Learning Management Course Access Issue,Online training platform denies access to enrolled users due to role misconfiguration.,Diana,Judy,Bug,Medium,Open,Learning Management,14-05-2025,18-05-2025,4,5,2,5,learning management course access issue,online training platform denies access to enrolled users due to role misconfiguration,learning management course access issue online training platform denies access to enrolled users due to role misconfiguration,learn course access,online training denies access enrol role misconfiguration,learn course access online training denies access enrol role misconfiguration,5,12,17
SWP-64,Risk Assessment Tool,"Develop risk management system with threat identification, impact analysis, and mitigation planning.",Frank,Ivan,Task,High,In Progress,Risk Management,06-06-2025,18-06-2025,12,6,4,6,risk assessment tool,develop risk management system with threat identification impact analysis and mitigation planning,risk assessment tool develop risk management system with threat identification impact analysis and mitigation planning,risk assessment,risk threat identification impact analysis mitigation planning,risk assessment risk threat identification impact analysis mitigation planning,3,12,15
SWP-65,Survey Platform,"Create survey creation and distribution system with response collection, analysis, and reporting capabilities.",Diana,Heidi,Story,Medium,Done,Feedback,10-06-2025,25-06-2025,15,6,1,6,survey platform,create survey creation and distribution system with response collection analysis and reporting capabilities,survey platform create survey creation and distribution system with response collection analysis and reporting capabilities,survey,survey creation distribution response collection analysis reporting capability,survey survey creation distribution response collection analysis reporting capability,2,13,15
SWP-66,Calendar Integration,"Implement calendar synchronization with multiple providers, scheduling conflicts detection, and meeting management.",Charlie,Ivan,Story,Medium,Done,Scheduling,25-06-2025,02-07-2025,7,6,2,7,calendar integration,implement calendar synchronization with multiple providers scheduling conflicts detection and meeting management,calendar integration implement calendar synchronization with multiple providers scheduling conflicts detection and meeting management,calendar integration,calendar synchronization multiple provider conflict detection,calendar integration calendar synchronization multiple provider conflict detection,2,12,14
SWP-67,Ticketing System,"Build support ticket management with priority queues, SLA tracking, and customer communication tools.",Bob,Judy,Story,Medium,Done,Support,05-06-2025,18-06-2025,13,6,3,6,ticketing system,build support ticket management with priority queues sla tracking and customer communication tools,ticketing system build support ticket management with priority queues sla tracking and customer communication tools,ticket,support queue track,ticket support queue track,2,13,15
SWP-68,Warehouse Management,"Create inventory control system with picking optimization, shipping integration, and stock level monitoring.",Eve,Ivan,Epic,High,Done,Inventory Management,23-06-2025,03-07-2025,10,6,0,7,warehouse management,create inventory control system with picking optimization shipping integration and stock level monitoring,warehouse management create inventory control system with picking optimization shipping integration and stock level monitoring,warehouse,inventory control pick optimization ship integration stock level monitoring,warehouse inventory control pick optimization ship integration stock level monitoring,2,13,15
SWP-69,Lead Management System,"Build sales lead tracking with scoring algorithms, nurturing campaigns, and conversion analytics.",Charlie,Heidi,Story,Medium,In Progress,Sales,25-05-2025,29-05-2025,4,5,6,5,lead management system,build sales lead tracking with scoring algorithms nurturing campaigns and conversion analytics,lead management system build sales lead tracking with scoring algorithms nurturing campaigns and conversion analytics,,sale track score algorithms nurturing campaign conversion analytics, sale track score algorithms nurturing campaign conversion analytics,3,12,15
SWP-70,Performance Review Platform,"Develop employee evaluation system with goal setting, 360-degree feedback, and performance analytics.",Frank,Ivan,Story,Medium,Done,HR Management,04-06-2025,08-06-2025,4,6,2,6,performance review platform,develop employee evaluation system with goal setting degree feedback and performance analytics,performance review platform develop employee evaluation system with goal setting degree feedback and performance analytics,performance,employee evaluation goal degree performance analytics,performance employee evaluation goal degree performance analytics,3,12,15
SWP-71,Deployment Automation,"Create automated deployment pipeline with blue-green deployments, rollback capabilities, and environment management.",Charlie,Grace,Task,High,Done,CI/CD,24-05-2025,27-05-2025,3,5,5,5,deployment automation,create automated deployment pipeline with bluegreen deployments rollback capabilities and environment management,deployment automation create automated deployment pipeline with bluegreen deployments rollback capabilities and environment management,deployment automation,automate deployment bluegreen deployment rollback capability,deployment automation automate deployment bluegreen deployment rollback capability,2,12,14
SWP-72,Data Synchronization,Implement real-time data sync between multiple systems with conflict resolution and consistency guarantees.,Bob,Grace,Task,High,In Progress,Data Sync,12-05-2025,19-05-2025,7,5,0,5,data synchronization,implement realtime data sync between multiple systems with conflict resolution and consistency guarantees,data synchronization implement realtime data sync between multiple systems with conflict resolution and consistency guarantees,synchronization,realtime sync multiple conflict resolution consistency guarantee,synchronization realtime sync multiple conflict resolution consistency guarantee,2,13,15
SWP-73,Mobile Device Policy Enforcement Failure,MDM solution fails to enforce policies on enrolled Android devices.,Bob,Heidi,Bug,High,Open,Mobile Device Management,04-06-2025,19-06-2025,15,6,2,6,mobile device policy enforcement failure,mdm solution fails to enforce policies on enrolled android devices,mobile device policy enforcement failure mdm solution fails to enforce policies on enrolled android devices,mobile device policy enforcement failure,mdm fail enforce policy enrol device,mobile device policy enforcement failure mdm fail enforce policy enrol device,5,10,15
SWP-74,Content Moderation System,"Create automated content filtering with machine learning models, human review workflows, and policy enforcement.",Bob,Judy,Task,High,In Progress,Content Moderation,29-05-2025,08-06-2025,10,5,3,6,content moderation system,create automated content filtering with machine learning models human review workflows and policy enforcement,content moderation system create automated content filtering with machine learning models human review workflows and policy enforcement,content moderation,automate content filtering machine learn model human policy enforcement,content moderation automate content filtering machine learn model human policy enforcement,3,14,17
SWP-75,Disaster Recovery Planning,"Implement business continuity system with backup procedures, recovery testing, and failover automation.",Frank,Grace,Epic,High,Done,Backup,04-07-2025,19-07-2025,15,7,4,7,disaster recovery planning,implement business continuity system with backup procedures recovery testing and failover automation,disaster recovery planning implement business continuity system with backup procedures recovery testing and failover automation,disaster recovery planning,continuity backup recovery failover automation,disaster recovery planning continuity backup recovery failover automation,3,12,15
SWP-76,Integration Testing Suite,"Build comprehensive integration testing with service mocking, contract testing, and dependency validation.",Bob,Grace,Task,Medium,Done,Testing,06-06-2025,15-06-2025,9,6,4,6,integration testing suite,build comprehensive integration testing with service mocking contract testing and dependency validation,integration testing suite build comprehensive integration testing with service mocking contract testing and dependency validation,integration suite,comprehensive integration mock contract dependency,integration suite comprehensive integration mock contract dependency,3,12,15
SWP-77,User Access Management,"Create role-based access control with permission management, user provisioning, and access reviews.",Frank,Heidi,Task,High,Done,Authentication,17-06-2025,24-06-2025,7,6,1,6,user access management,create rolebased access control with permission management user provisioning and access reviews,user access management create rolebased access control with permission management user provisioning and access reviews,access,rolebased access control permission provision access,access rolebased access control permission provision access,3,12,15
SWP-78,Metrics Collection Dashboard Crash,Business metrics dashboard crashes when rendering large datasets.,Alice,Grace,Bug,Medium,In Progress,Analytics,09-06-2025,14-06-2025,5,6,0,6,metrics collection dashboard crash,business metrics dashboard crashes when rendering large datasets,metrics collection dashboard crash business metrics dashboard crashes when rendering large datasets,metric collection dashboard crash,metric dashboard crash render large datasets,metric collection dashboard crash metric dashboard crash render large datasets,4,8,12
SWP-79,Code Quality Analysis,"Implement static code analysis with quality gates, technical debt tracking, and improvement recommendations.",Eve,Judy,Task,Medium,Done,Code Quality,30-06-2025,10-07-2025,10,6,0,7,code quality analysis,implement static code analysis with quality gates technical debt tracking and improvement recommendations,code quality analysis implement static code analysis with quality gates technical debt tracking and improvement recommendations,analysis,static analysis gate technical debt track improvement recommendation,analysis static analysis gate technical debt track improvement recommendation,3,13,16
SWP-80,Customer Segmentation Error,Customer classification system missegments users due to incorrect behavioral data parsing.,Frank,Grace,Bug,Medium,Open,Analytics,08-06-2025,23-06-2025,15,6,6,6,customer segmentation error,customer classification system missegments users due to incorrect behavioral data parsing,customer segmentation error customer classification system missegments users due to incorrect behavioral data parsing,segmentation error,classification missegments incorrect behavioral parsing,segmentation error classification missegments incorrect behavioral parsing,3,11,14
SWP-81,Fraud Detection System,"Build real-time fraud monitoring with machine learning models, rule engines, and investigation workflows.",Eve,Judy,Task,High,In Progress,Fraud Detection,22-05-2025,04-06-2025,13,5,3,6,fraud detection system,build realtime fraud monitoring with machine learning models rule engines and investigation workflows,fraud detection system build realtime fraud monitoring with machine learning models rule engines and investigation workflows,fraud detection,realtime fraud monitoring machine learn model rule engine investigation,fraud detection realtime fraud monitoring machine learn model rule engine investigation,3,13,16
SWP-82,Capacity Planning Tool,"Develop resource planning system with usage forecasting, scaling recommendations, and cost optimization.",Bob,Ivan,Task,Medium,In Progress,Resource Management,23-06-2025,02-07-2025,9,6,0,7,capacity planning tool,develop resource planning system with usage forecasting scaling recommendations and cost optimization,capacity planning tool develop resource planning system with usage forecasting scaling recommendations and cost optimization,capacity planning,resource planning usage forecast scale recommendation cost optimization,capacity planning resource planning usage forecast scale recommendation cost optimization,3,12,15
SWP-83,Service Mesh Implementation,"Deploy microservices communication layer with traffic management, security policies, and observability.",Alice,Judy,Epic,High,In Progress,Microservices,31-05-2025,11-06-2025,11,5,5,6,service mesh implementation,deploy microservices communication layer with traffic management security policies and observability,service mesh implementation deploy microservices communication layer with traffic management security policies and observability,mesh,deploy microservices layer traffic security policy observability,mesh deploy microservices layer traffic security policy observability,3,11,14
